{
  "$schema": "./pack_schema.json",
  "id": "english-core-words",
  "title": "영어: 핵심 단어",
  "subject": "english",
  "grade_band": "g5-8",
  "version": "0.1.0",
  "locale": "ko-KR",
  "items": [
    { "id": "e-001", "type": "mc", "prompt": "apple의 뜻은?", "choices": ["사과", "포도", "바나나", "배"], "answer": 0, "difficulty": 1, "tags": ["topic:food", "skill:meaning"], "explanation": "apple은 '사과'라는 뜻이에요." },
    { "id": "e-002", "type": "mc", "prompt": "'학교'를 뜻하는 영어 단어는?", "choices": ["school", "hospital", "library", "market"], "answer": 0, "difficulty": 1, "tags": ["topic:place", "skill:meaning"], "explanation": "'학교'는 영어로 school이에요." },
    { "id": "e-003", "type": "input", "input_kind": "word", "prompt": "'친구'를 영어로 쓰세요.", "answer": ["friend"], "difficulty": 1, "tags": ["topic:people", "skill:spelling"], "explanation": "'친구'는 friend이며 i가 e보다 먼저 와요." },
    { "id": "e-004", "type": "tf", "prompt": "happy는 '슬픈'이라는 뜻이다.", "answer": false, "difficulty": 1, "tags": ["topic:feeling", "skill:meaning"], "explanation": "happy는 '행복한, 기쁜'이고 '슬픈'은 sad예요." },
    { "id": "e-005", "type": "input", "input_kind": "word", "prompt": "'책'을 영어로 쓰세요.", "answer": ["book"], "difficulty": 1, "tags": ["topic:object", "skill:spelling"], "explanation": "'책'은 book이며 o가 두 번 들어가요." },
    { "id": "e-006", "type": "mc", "prompt": "water의 뜻은?", "choices": ["불", "물", "바람", "흙"], "answer": 1, "difficulty": 1, "tags": ["topic:nature", "skill:meaning"], "explanation": "water는 '물'이라는 뜻이에요." },
    { "id": "e-007", "type": "mc", "prompt": "borrow의 뜻은?", "choices": ["빌리다", "빌려주다", "사다", "팔다"], "answer": 0, "difficulty": 2, "tags": ["topic:verb", "skill:meaning", "misconception:borrow-lend"], "explanation": "borrow는 '빌리다'이고 '빌려주다'는 lend예요." },
    { "id": "e-008", "type": "input", "input_kind": "word", "prompt": "'도서관'을 영어로 쓰세요.", "answer": ["library"], "difficulty": 2, "tags": ["topic:place", "skill:spelling"], "explanation": "'도서관'은 library이며 r이 두 번 들어가요." },
    { "id": "e-009", "type": "mc", "prompt": "빈칸에 알맞은 말은? I ___ breakfast every morning.", "choices": ["have", "has", "having", "had"], "answer": 0, "difficulty": 2, "tags": ["topic:grammar", "skill:context"], "explanation": "주어가 I이고 매일 하는 일이므로 현재형 have를 써요." },
    { "id": "e-010", "type": "tf", "prompt": "enormous는 '아주 작은'이라는 뜻이다.", "answer": false, "difficulty": 2, "tags": ["topic:adjective", "skill:meaning"], "explanation": "enormous는 '매우 큰, 거대한'이라는 뜻이에요." },
    { "id": "e-011", "type": "input", "input_kind": "word", "prompt": "'아름다운'을 뜻하는 영어 단어를 쓰세요. (b로 시작)", "answer": ["beautiful"], "difficulty": 2, "tags": ["topic:adjective", "skill:spelling"], "explanation": "'아름다운'은 beautiful이며 beauty에서 온 말이에요." },
    { "id": "e-012", "type": "mc", "prompt": "ancient의 뜻은?", "choices": ["고대의", "현대의", "새로운", "멋진"], "answer": 0, "difficulty": 2, "tags": ["topic:adjective", "skill:meaning"], "explanation": "ancient는 '고대의, 아주 오래된'이라는 뜻이에요." },
    { "id": "e-013", "type": "input", "input_kind": "word", "prompt": "'날씨'를 영어로 쓰세요.", "answer": ["weather"], "difficulty": 2, "tags": ["topic:nature", "skill:spelling"], "explanation": "'날씨'는 weather이며 ea 철자에 주의해요." },
    { "id": "e-014", "type": "mc", "prompt": "ordinary와 뜻이 가장 가까운 단어는?", "choices": ["usual", "strange", "expensive", "dangerous"], "answer": 0, "difficulty": 3, "tags": ["topic:adjective", "skill:synonym"], "explanation": "ordinary는 '평범한'이라는 뜻으로 usual(보통의)과 비슷해요." },
    { "id": "e-015", "type": "mc", "prompt": "reluctant의 뜻은?", "choices": ["내키지 않는", "열정적인", "용감한", "정직한"], "answer": 0, "difficulty": 3, "tags": ["topic:adjective", "skill:meaning"], "explanation": "reluctant는 '마음이 내키지 않는, 꺼리는'이라는 뜻이에요." },
    { "id": "e-016", "type": "input", "input_kind": "word", "prompt": "'환경'을 영어로 쓰세요.", "answer": ["environment"], "difficulty": 3, "tags": ["topic:science", "skill:spelling"], "explanation": "'환경'은 environment이며 중간의 n을 빠뜨리기 쉬워요." },
    { "id": "e-017", "type": "tf", "prompt": "achieve는 '이루다, 달성하다'라는 뜻이다.", "answer": true, "difficulty": 3, "tags": ["topic:verb", "skill:meaning"], "explanation": "achieve는 목표를 '이루다, 달성하다'라는 뜻이에요." },
    { "id": "e-018", "type": "mc", "prompt": "빈칸에 알맞은 말은? She was ___ to hear the good news. (기쁜)", "choices": ["delighted", "delayed", "deleted", "delivered"], "answer": 0, "difficulty": 3, "tags": ["topic:feeling", "skill:context"], "explanation": "좋은 소식을 듣고 '매우 기뻐한'이라는 뜻의 delighted가 알맞아요." },
    { "id": "e-019", "type": "input", "input_kind": "word", "prompt": "'편안한'을 영어로 쓰세요.", "answer": ["comfortable"], "difficulty": 3, "tags": ["topic:adjective", "skill:spelling"], "explanation": "'편안한'은 comfortable이며 comfort에 -able이 붙은 말이에요." },
    { "id": "e-020", "type": "mc", "prompt": "although의 뜻으로 알맞은 것은?", "choices": ["~이지만", "~때문에", "~한다면", "~하기 전에"], "answer": 0, "difficulty": 3, "tags": ["topic:grammar", "skill:meaning"], "explanation": "although는 앞뒤 내용이 서로 대조될 때 쓰는 '~이지만'이라는 뜻이에요." }
  ]
}
